[
  {
    "id": "pol-star-comp-5l",
    "insurer_id": "ins-star-health",
    "policy_name": "Star Comprehensive Insurance Policy",
    "policy_type": "INDIVIDUAL",
    "policy_number_masked": "STAR-COMP-XXXX-8921",
    "sum_insured": 500000,
    "remaining_sum_insured": 500000,
    "room_eligibility": "PRIVATE_AC",
    "copay_percentage": 0,
    "deductible_amount": 0,
    "cashless_supported": true,
    "preauthorization_supported": true,
    "pre_hospitalization_days": 60,
    "post_hospitalization_days": 90,
    "data_status": "PUBLIC_REFERENCE",
    "verification_status": "VERIFIED",
    "confidence": "HIGH"
  },
  {
    "id": "pol-hdfc-optima-10l",
    "insurer_id": "ins-hdfc-ergo",
    "policy_name": "Optima Restore Family Floater",
    "policy_type": "FAMILY_FLOATER",
    "policy_number_masked": "HDFC-OPT-XXXX-4412",
    "sum_insured": 1000000,
    "remaining_sum_insured": 1000000,
    "room_eligibility": "ANY_ROOM",
    "copay_percentage": 0,
    "deductible_amount": 0,
    "cashless_supported": true,
    "preauthorization_supported": true,
    "pre_hospitalization_days": 60,
    "post_hospitalization_days": 180,
    "data_status": "PUBLIC_REFERENCE",
    "verification_status": "VERIFIED",
    "confidence": "HIGH"
  },
  {
    "id": "pol-niva-reassure-10l",
    "insurer_id": "ins-niva-bupa",
    "policy_name": "Niva Bupa ReAssure 2.0 Titanium",
    "policy_type": "INDIVIDUAL",
    "policy_number_masked": "NIVA-REA-XXXX-7731",
    "sum_insured": 1000000,
    "remaining_sum_insured": 850000,
    "room_eligibility": "ANY_ROOM",
    "copay_percentage": 0,
    "deductible_amount": 0,
    "cashless_supported": true,
    "preauthorization_supported": true,
    "pre_hospitalization_days": 60,
    "post_hospitalization_days": 180,
    "data_status": "PUBLIC_REFERENCE",
    "verification_status": "VERIFIED",
    "confidence": "HIGH"
  },
  {
    "id": "pol-care-supreme-7l",
    "insurer_id": "ins-care-health",
    "policy_name": "Care Supreme Health Insurance",
    "policy_type": "INDIVIDUAL",
    "policy_number_masked": "CARE-SUP-XXXX-1029",
    "sum_insured": 700000,
    "remaining_sum_insured": 700000,
    "room_eligibility": "PRIVATE_AC",
    "copay_percentage": 0,
    "deductible_amount": 0,
    "cashless_supported": true,
    "preauthorization_supported": true,
    "pre_hospitalization_days": 60,
    "post_hospitalization_days": 90,
    "data_status": "PUBLIC_REFERENCE",
    "verification_status": "VERIFIED",
    "confidence": "HIGH"
  },
  {
    "id": "pol-new-india-mediclaim-3l",
    "insurer_id": "ins-new-india",
    "policy_name": "New India Floater Mediclaim",
    "policy_type": "FAMILY_FLOATER",
    "policy_number_masked": "NIA-FLT-XXXX-3382",
    "sum_insured": 300000,
    "remaining_sum_insured": 120000,
    "room_eligibility": "SEMI_PRIVATE",
    "copay_percentage": 10,
    "deductible_amount": 5000,
    "cashless_supported": true,
    "preauthorization_supported": true,
    "pre_hospitalization_days": 30,
    "post_hospitalization_days": 60,
    "data_status": "PUBLIC_REFERENCE",
    "verification_status": "VERIFIED",
    "confidence": "HIGH"
  },
  {
    "id": "pol-pmjay-scheme-5l",
    "insurer_id": "sch-pmjay",
    "policy_name": "Ayushman Bharat PM-JAY Golden Card",
    "policy_type": "GOVERNMENT_SCHEME",
    "policy_number_masked": "AB-PMJAY-XXXX-5501",
    "sum_insured": 500000,
    "remaining_sum_insured": 500000,
    "room_eligibility": "GENERAL",
    "copay_percentage": 0,
    "deductible_amount": 0,
    "cashless_supported": true,
    "preauthorization_supported": true,
    "pre_hospitalization_days": 3,
    "post_hospitalization_days": 15,
    "data_status": "PUBLIC_REFERENCE",
    "verification_status": "VERIFIED",
    "confidence": "HIGH"
  }
]
